{
  "$schema": "https://json-schema.org/draft/2020-12/schema",
  "$id": "https://docs.oasis-open.org/ubl/2/json/schemas/UBL-Forecast-2",
  "description": "A document used to forecast sales or orders.",
  "type": "object",
  "properties": {
    "UBLEntity": {
      "const": "https://docs.oasis-open.org/ubl/2/json/schemas/UBL-Forecast-2",
      "description": "Identifies the JSON schema governing this instance."
    },
    "UBLExtensions": {
      "$ref": "https://docs.oasis-open.org/ubl/2/json/schemas/CommonExtensionComponents-2#/$defs/UBLExtensionsType"
    },
    "Signature": {
      "oneOf": [
        {
          "$ref": "https://docs.oasis-open.org/ubl/2/json/schemas/CommonAggregateComponents-2#/$defs/SignatureType"
        },
        {
          "type": "array",
          "items": {
            "$ref": "https://docs.oasis-open.org/ubl/2/json/schemas/CommonAggregateComponents-2#/$defs/SignatureType"
          },
          "minItems": 1
        }
      ]
    },
    "UBLVersionID": {
      "$ref": "https://docs.oasis-open.org/ubl/2/json/schemas/CommonBasicComponents-2#/$defs/UBLVersionID"
    },
    "CustomizationID": {
      "$ref": "https://docs.oasis-open.org/ubl/2/json/schemas/CommonBasicComponents-2#/$defs/CustomizationID"
    },
    "ProfileID": {
      "$ref": "https://docs.oasis-open.org/ubl/2/json/schemas/CommonBasicComponents-2#/$defs/ProfileID"
    },
    "ProfileExecutionID": {
      "$ref": "https://docs.oasis-open.org/ubl/2/json/schemas/CommonBasicComponents-2#/$defs/ProfileExecutionID"
    },
    "ID": {
      "$ref": "https://docs.oasis-open.org/ubl/2/json/schemas/CommonBasicComponents-2#/$defs/ID"
    },
    "UUID": {
      "$ref": "https://docs.oasis-open.org/ubl/2/json/schemas/CommonBasicComponents-2#/$defs/UUID"
    },
    "IssueDate": {
      "$ref": "https://docs.oasis-open.org/ubl/2/json/schemas/CommonBasicComponents-2#/$defs/IssueDate"
    },
    "IssueTime": {
      "$ref": "https://docs.oasis-open.org/ubl/2/json/schemas/CommonBasicComponents-2#/$defs/IssueTime"
    },
    "Note": {
      "oneOf": [
        {
          "$ref": "https://docs.oasis-open.org/ubl/2/json/schemas/CommonBasicComponents-2#/$defs/Note"
        },
        {
          "type": "array",
          "items": {
            "$ref": "https://docs.oasis-open.org/ubl/2/json/schemas/CommonBasicComponents-2#/$defs/Note"
          },
          "minItems": 1
        }
      ]
    },
    "VersionID": {
      "$ref": "https://docs.oasis-open.org/ubl/2/json/schemas/CommonBasicComponents-2#/$defs/VersionID"
    },
    "BasedOnConsensusIndicator": {
      "$ref": "https://docs.oasis-open.org/ubl/2/json/schemas/CommonBasicComponents-2#/$defs/BasedOnConsensusIndicator"
    },
    "ForecastPurposeCode": {
      "$ref": "https://docs.oasis-open.org/ubl/2/json/schemas/CommonBasicComponents-2#/$defs/ForecastPurposeCode"
    },
    "ForecastPeriod": {
      "$ref": "https://docs.oasis-open.org/ubl/2/json/schemas/CommonAggregateComponents-2#/$defs/PeriodType"
    },
    "AdditionalDocumentReference": {
      "oneOf": [
        {
          "$ref": "https://docs.oasis-open.org/ubl/2/json/schemas/CommonAggregateComponents-2#/$defs/DocumentReferenceType"
        },
        {
          "type": "array",
          "items": {
            "$ref": "https://docs.oasis-open.org/ubl/2/json/schemas/CommonAggregateComponents-2#/$defs/DocumentReferenceType"
          },
          "minItems": 1
        }
      ]
    },
    "SenderParty": {
      "$ref": "https://docs.oasis-open.org/ubl/2/json/schemas/CommonAggregateComponents-2#/$defs/PartyType"
    },
    "ReceiverParty": {
      "$ref": "https://docs.oasis-open.org/ubl/2/json/schemas/CommonAggregateComponents-2#/$defs/PartyType"
    },
    "BuyerCustomerParty": {
      "$ref": "https://docs.oasis-open.org/ubl/2/json/schemas/CommonAggregateComponents-2#/$defs/CustomerPartyType"
    },
    "SellerSupplierParty": {
      "$ref": "https://docs.oasis-open.org/ubl/2/json/schemas/CommonAggregateComponents-2#/$defs/SupplierPartyType"
    },
    "ForecastLine": {
      "oneOf": [
        {
          "$ref": "https://docs.oasis-open.org/ubl/2/json/schemas/CommonAggregateComponents-2#/$defs/ForecastLineType"
        },
        {
          "type": "array",
          "items": {
            "$ref": "https://docs.oasis-open.org/ubl/2/json/schemas/CommonAggregateComponents-2#/$defs/ForecastLineType"
          },
          "minItems": 1
        }
      ]
    }
  },
  "required": [
    "UBLEntity",
    "ID",
    "IssueDate",
    "ForecastPurposeCode",
    "ForecastPeriod",
    "SenderParty",
    "ReceiverParty",
    "ForecastLine"
  ],
  "additionalProperties": false,
  "minProperties": 1,
  "title": "Forecast. Details"
}
